{
  "schema_version": "1",
  "slug": "xero",
  "app_name": "Xero",
  "guide_type": "curated",
  "last_verified": "2026-10-21",
  "composio": {
    "toolkit_slug": "xero",
    "status": "byo",
    "callback_url": "https://backend.composio.dev/api/v3/toolkits/auth/callback",
    "callback_note": "Copy the exact redirect URI shown in your Composio auth config; some toolkits still show the legacy https://backend.composio.dev/api/v1/auth-apps/add."
  },
  "verdict": {
    "tier": "verify_to_scale",
    "summary": "Self-serve: you create the Xero app yourself and it works at once for 5 customer organisations, or 50 once you add a credit card. No review is found up to 50. Beyond 50 you need Xero certification, which takes months and has no official timeline. Each customer's own Xero organisation also allows only five uncertified apps.",
    "effort_hours": {
      "min": 1,
      "max": 3
    },
    "calendar": {
      "min_days": 0,
      "max_days": null,
      "label": "Same day to start (up to 50 connections); months more if you need over 50, with no official wait"
    },
    "calendar_basis": "estimate",
    "confidence": "medium"
  },
  "situations": {
    "questions": [
      {
        "id": "scale",
        "text": "How many customer Xero organisations will connect through your app?",
        "options": [
          {
            "id": "up_to_5",
            "label": "5 or fewer (a prototype or pilot)"
          },
          {
            "id": "up_to_50",
            "label": "6 to 50"
          },
          {
            "id": "over_50",
            "label": "More than 50"
          }
        ]
      },
      {
        "id": "customer_apps",
        "text": "Do your customers' Xero organisations already connect many other third-party apps?",
        "options": [
          {
            "id": "few",
            "label": "Probably not"
          },
          {
            "id": "many",
            "label": "Yes, or I don't know"
          }
        ]
      }
    ],
    "variants": [
      {
        "when": {
          "scale": "over_50"
        },
        "tier": "review_required",
        "summary": "Past 50 connections you must get your app certified by Xero (the Plus tier allows 1,000 connections). You need 10 active customer connections, a Sign Up with Xero flow and an application through Manage Plan. A security self-assessment is needed before 1,000 connections.",
        "calendar_label": "Several months; Xero states no overall wait",
        "notes": [
          "Certification means building to Xero's eight checkpoints: roughly 40 to 120 hours of engineering (our estimate, not Xero's).",
          "The Plus tier costs AUD 245 a month; there is no separate certification fee in the pages we read.",
          "Certified apps are not subject to the per-organisation five-app limit."
        ]
      },
      {
        "when": {
          "customer_apps": "many"
        },
        "tier": "verify_to_scale",
        "summary": "Your app works, but a customer whose Xero organisation already has five uncertified apps cannot add yours until they remove one or your app is certified.",
        "calendar_label": "Same day for you; depends on each customer's organisation",
        "notes": [
          "The five-app limit counts uncertified apps in the customer's organisation, not your connection count.",
          "A Custom Connection (one organisation, extra monthly subscription) is not counted toward the five-app limit."
        ]
      },
      {
        "when": {
          "scale": "up_to_50"
        },
        "tier": "verify_to_scale",
        "summary": "Add a credit card in the developer portal to move from Starter (5 connections) to Core (50 connections, AUD 35 a month). We found no review step for this.",
        "calendar_label": "Same day (about 1 to 3 hours)",
        "notes": [
          "Docs say a card moves you to Core, but the Manage Plan screen was not seen; check it on first sign-in."
        ]
      },
      {
        "when": {
          "scale": "up_to_5"
        },
        "tier": "instant",
        "summary": "A new app starts on the free Starter tier with 5 connections and no card. It works as soon as you create it.",
        "calendar_label": "Same day (about 1 to 2 hours)",
        "notes": [
          "Starter allows 1,000 API calls a day per organisation.",
          "You can test on the Xero demo company."
        ]
      }
    ]
  },
  "byo_advice": "Composio has no managed Xero app, so you bring your own: create the Xero app, then give Composio its client ID and secret. Use your own product name on it. Check Xero's developer terms before you serve many customers from one app (see open questions).",
  "before_you_start": [
    {
      "text": "A Xero login (free). The developer portal redirects straight to a Xero sign-in with email and password, and there is a Sign up link if you have no account.",
      "evidence": {
        "label": "TESTED",
        "source_id": "s16",
        "quote": null,
        "found_in": null,
        "note": "developer.xero.com/app/manage redirected to login.xero.com/identity/user/login on 2026-10-21; the page showed Email and Password fields and a Sign up link, with no bot check."
      }
    },
    {
      "text": "A free Xero account is the first step in Xero's own getting-started list.",
      "evidence": {
        "label": "DOCS",
        "source_id": "s1",
        "quote": "Signup for a free Xero account",
        "found_in": "visible",
        "note": null
      }
    },
    {
      "text": "Enable the Xero demo company so you can test without a real customer. It resets 28 days after creation, so you will need to reconnect it.",
      "evidence": {
        "label": "DOCS",
        "source_id": "s1",
        "quote": "Enable the Xero demo company",
        "found_in": "visible",
        "note": null
      }
    },
    {
      "text": "A credit card, only if you need more than 5 connections.",
      "evidence": {
        "label": "DOCS",
        "source_id": "s4",
        "quote": "Your card details will be required when moving from the Starter to the Core plan.",
        "found_in": "visible",
        "note": null
      }
    },
    {
      "text": "Apps in some categories need Xero's prior approval before you can apply: Practice APIs including Xero Practice Manager, and financial services such as banking, payments, lending and insurance.",
      "evidence": {
        "label": "DOCS",
        "source_id": "s6",
        "quote": "you’ll need prior approval from us and additional permissions before you can apply",
        "found_in": "visible",
        "note": null
      }
    },
    {
      "text": "You must have your own legally binding terms of use and privacy policy for your app.",
      "evidence": {
        "label": "DOCS",
        "source_id": "s11",
        "quote": "Your apps must include your own legally binding terms of use and privacy policy",
        "found_in": "visible",
        "note": null
      }
    }
  ],
  "limits": [
    {
      "what": "Connections on the Starter tier",
      "value": 5,
      "unit": "connections",
      "scope": "per app",
      "evidence": {
        "label": "DOCS",
        "source_id": "s3",
        "quote": "New apps default to the starter tier with 5 connections.",
        "found_in": "visible",
        "note": null
      }
    },
    {
      "what": "Connections on the Core tier",
      "value": 50,
      "unit": "connections",
      "scope": "per app",
      "evidence": {
        "label": "DOCS",
        "source_id": "s3",
        "quote": "Moving up to Core will give you up to 50 connections.",
        "found_in": "visible",
        "note": "Core needs a card on file; the pricing page lists Payment Method as Required."
      }
    },
    {
      "what": "Connections on the Plus tier (needs certification)",
      "value": 1000,
      "unit": "connections",
      "scope": "per app",
      "evidence": {
        "label": "DOCS",
        "source_id": "s4",
        "quote": "Connections (maximum) 5 50 1000 10,000 No Limit",
        "found_in": "visible",
        "note": "Same table shows Plus needs App Certification."
      }
    },
    {
      "what": "Uncertified apps a customer organisation can connect",
      "value": 5,
      "unit": "apps",
      "scope": "per customer Xero organisation or practice",
      "evidence": {
        "label": "DOCS",
        "source_id": "s3",
        "quote": "each organisation or practice is limited to connecting a maximum of five uncertified apps",
        "found_in": "visible",
        "note": "A Xero FAQ answer says 2 instead; see conflicts."
      }
    },
    {
      "what": "Redirect URIs per app",
      "value": 50,
      "unit": "URIs",
      "scope": "per app",
      "evidence": {
        "label": "DOCS",
        "source_id": "s5",
        "quote": "You can use up to 50 redirect URIs for your app.",
        "found_in": "visible",
        "note": null
      }
    },
    {
      "what": "API calls a day on the Starter tier",
      "value": 1000,
      "unit": "calls per day",
      "scope": "per connected organisation (higher tiers get 5,000)",
      "evidence": {
        "label": "DOCS",
        "source_id": "s3",
        "quote": "1,000 calls per day for starter, 5,000 calls per day for higher tiers",
        "found_in": "visible",
        "note": null
      }
    },
    {
      "what": "Core tier monthly fee",
      "value": 35,
      "unit": "AUD per month",
      "scope": "per app; Plus is 245 AUD per month",
      "evidence": {
        "label": "DOCS",
        "source_id": "s4",
        "quote": "Monthly Tier Fee No charge $35 AUD $245 AUD $1445 AUD Price on Application",
        "found_in": "visible",
        "note": "Quote is the fee row of the pricing table: Starter no charge, Core 35 AUD, Plus 245 AUD, Advanced 1445 AUD."
      }
    },
    {
      "what": "Demo company reset period",
      "value": 28,
      "unit": "days",
      "scope": "per demo company",